Продукт,Калорийность,Углеводы,Белки,Жиры
Авокадо,160 кКал,"1,83 г",2 г,"14,66 г"
"Авокадо, Калифорнийские, сырые",167 кКал,"1,84 г","1,96 г","15,41 г"
"Авокадо, Флоридские, сырые",120 кКал,"2,22 г","2,23 г","10,06 г"
Агава приготовленная,135 кКал,"21,4 г","0,99 г","0,29 г"
Агава сушеная,341 кКал,"66,38 г","1,71 г","0,69 г"
Агава сырая,68 кКал,"9,63 г","0,52 г","0,15 г"
Айсберг (салат кочанный),14 кКал,"1,77 г","0,9 г","0,14 г"
"Амарант листья, вареные, без соли",21 кКал,"4,11 г","2,11 г","0,18 г"
"Амарант листья, сырые",23 кКал,"4,02 г","2,46 г","0,33 г"
"Амарант, листья, вареные, с солью",21 кКал,"4,11 г","2,11 г","0,18 г"
Артишок,47 кКал,"5,11 г","3,27 г","0,15 г"
Артишок вареный с солью,51 кКал,"5,69 г","2,89 г","0,34 г"
"Артишок вареный, без соли",53 кКал,"6,25 г","2,89 г","0,34 г"
"Артишок вареный, замороженные, без соли",45 кКал,"4,58 г","3,11 г","0,5 г"
"Артишок замороженные, вареные, с солью",45 кКал,"4,58 г","3,11 г","0,5 г"
Артишок замороженный неприготовленный,38 кКал,"3,85 г","2,63 г","0,43 г"
"Артишок испанский, вареный, без соли",22 кКал,"3,63 г","0,76 г","0,11 г"
"Артишок испанский, вареный, с солью",20 кКал,"3,04 г","0,76 г","0,11 г"
"Артишок испанский, сырой",17 кКал,"2,47 г","0,7 г","0,1 г"
"Аурикулярия густоволосистая, сушеная",284 кКал,"2,91 г","9,25 г","0,73 г"
"Аурикулярия уховидная, сушеная",298 кКал,"81,03 г","4,82 г","0,44 г"
"Аурикулярия уховидная, сырая",25 кКал,"6,75 г","0,48 г","0,04 г"
"Базелла белая, приготовленная",23 кКал,"0,61 г","2,98 г","0,78 г"
Баклажан,24 кКал,"4,5 г","1,2 г","0,1 г"
"Баклажан, вареный, без соли",35 кКал,"6,23 г","0,83 г","0,23 г"
"Баклажан, вареный, с солью",33 кКал,"5,64 г","0,83 г","0,23 г"
"Баклажан, сырой",25 кКал,"2,88 г","0,98 г","0,18 г"
Баклажаны маринованные,49 кКал,"7,27 г","0,9 г","0,7 г"
Баклажаны фаршированные овощами по 1-266,83 кКал,"7,4 г","2,9 г","4,5 г"
"Бамбук, побеги вареные, с солью",11 кКал,"0,52 г","1,53 г","0,22 г"
"Бамбук, побеги, вареные, без соли",12 кКал,"0,92 г","1,53 г","0,22 г"
"Бамбук, побеги, консервированные, сухой продукт без маринада",19 кКал,"1,82 г","1,72 г","0,4 г"
"Бамбук, побеги, сырые",27 кКал,3 г,"2,6 г","0,3 г"
"Батат, картофель сладкий",60 кКал,"13,3 г",2 г,"0,05 г"
"Батат, картофель сладкий",86 кКал,"17,12 г","1,57 г","0,05 г"
"Батат, картофель сладкий запеченный в кожуре, без соли",90 кКал,"17,41 г","2,01 г","0,15 г"
"Батат, картофель сладкий, вареный без соли",76 кКал,"15,22 г","1,37 г","0,14 г"
"Батат, картофель сладкий, вареный с солью",76 кКал,"15,22 г","1,37 г","0,14 г"
"Батат, картофель сладкий, замороженный, запеченный без соли",100 кКал,"21,6 г","1,71 г","0,12 г"
"Батат, картофель сладкий, замороженный, запеченный с солью",100 кКал,"21,6 г","1,71 г","0,12 г"
"Батат, картофель сладкий, замороженный, неприготовленный",96 кКал,"20,52 г","1,71 г","0,18 г"
"Батат, картофель сладкий, запеченный в кожуре, с солью",90 кКал,"17,41 г","2,01 г","0,15 г"
"Батат, картофель сладкий, засахаренный, домашнего приготовления",164 кКал,"30,02 г","0,89 г","3,54 г"
"Батат, картофель сладкий, консервированный и вакуумной упаковке",91 кКал,"19,32 г","1,65 г","0,2 г"
"Батат, картофель сладкий, консервированный с сиропом",89 кКал,"18,43 г","0,98 г","0,2 г"
"Батат, картофель сладкий, консервированный с сиропом, сухой продукт без маринада",108 кКал,"22,36 г","1,28 г","0,32 г"
"Батат, картофель сладкий, листья, приготовленные на пару, без соли",35 кКал,"5,48 г","2,18 г","0,34 г"
"Батат, картофель сладкий, листья, приготовленные на пару, с солью",35 кКал,"5,48 г","2,18 г","0,34 г"
"Батат, картофель сладкий, листья, сырые",42 кКал,"3,52 г","2,49 г","0,51 г"
"Батат, картофель сладкий, пюре, консервированный",101 кКал,"21,49 г","1,98 г","0,2 г"
"Белокопытник , вареный, без соли",8 кКал,"2,16 г","0,23 г","0,02 г"
"Белокопытник японский, сырой",14 кКал,"3,61 г","0,39 г","0,04 г"
"Белокопытник, вареный, с солью",8 кКал,"2,16 г","0,23 г","0,02 г"
"Белокопытник, консервированный",3 кКал,"0,38 г","0,11 г","0,13 г"
"Бок-чой (пак-чой, китайская капуста)",13 кКал,"1,18 г","1,5 г","0,2 г"
"Бок-чой (пак-чой, китайская капуста) вареная, без соли",12 кКал,"0,78 г","1,56 г","0,16 г"
"Бок-чой (пак-чой, китайская капуста) вареная, с солью",12 кКал,"0,78 г","1,56 г","0,16 г"
Брокколи,34 кКал,"4,04 г","2,82 г","0,37 г"
"Брокколи китайская, приготовленная",22 кКал,"1,31 г","1,14 г","0,72 г"
"Брокколи, вареная, без соли",35 кКал,"3,88 г","2,38 г","0,41 г"
"Брокколи, вареная, с солью",35 кКал,"3,88 г","2,38 г","0,41 г"
"Брокколи, ветви, замороженная, вареная, с солью",28 кКал,"2,35 г","3,1 г","0,11 г"
"Брокколи, замороженная, вареная с солью",28 кКал,"2,35 г","3,1 г","0,12 г"
"Брокколи, замороженная, вареная, без соли",28 кКал,"2,35 г","3,1 г","0,12 г"
"Брокколи, замороженная, неприготовленная",26 кКал,"1,78 г","2,81 г","0,29 г"
"Брокколи, листья, сырая",28 кКал,"2,76 г","2,98 г","0,35 г"
"Брокколи, побеги, замороженные, вареные, без соли",28 кКал,"2,36 г","3,1 г","0,11 г"
"Брокколи, побеги, замороженные, неприготовленные",29 кКал,"2,35 г","3,06 г","0,34 г"
"Брокколи, стебель, сырая",28 кКал,"5,24 г","2,98 г","0,35 г"
"Брокколи, цветы, сырая",28 кКал,"2,76 г","2,98 г","0,35 г"
Брюква,37 кКал,"7,7 г","1,2 г","0,1 г"
Брюква припущенная по 1-214,54 кКал,"8,4 г","1,3 г","1,6 г"
"Брюква, вареная, без соли",30 кКал,"5,04 г","0,93 г","0,18 г"
"Брюква, вареная, с солью",30 кКал,"5,04 г","0,93 г","0,18 г"
"Брюква, сырая",37 кКал,"6,32 г","1,08 г","0,16 г"
Брюссельская капуста,35 кКал,"3,1 г","4,8 г","0,3 г"
"Брюссельская капуста, вареная, без соли",36 кКал,"4,5 г","2,55 г","0,5 г"
"Брюссельская капуста, вареная, с солью",36 кКал,"4,5 г","2,55 г","0,5 г"
"Брюссельская капуста, замороженная, вареная, без соли",42 кКал,"4,22 г","3,64 г","0,39 г"
"Брюссельская капуста, замороженная, вареная, с солью",42 кКал,"4,22 г","3,64 г","0,39 г"
"Брюссельская капуста, замороженная, неприготовленная",41 кКал,"4,06 г","3,78 г","0,41 г"
"Брюссельская капуста, сырая",43 кКал,"5,15 г","3,38 г","0,3 г"
"Валерианелла, сырая",21 кКал,"3,6 г",2 г,"0,4 г"
"Вассаби, корень, сырой",109 кКал,"15,74 г","4,8 г","0,63 г"
"Виноградные листья, консервированные",69 кКал,"1,81 г","4,27 г","1,97 г"
"Виноградные листья, сырые",93 кКал,"6,31 г","5,6 г","2,12 г"
Водный шпинат (болотная капуста),19 кКал,"1,03 г","2,6 г","0,2 г"
"Водный шпинат (болотная капуста) вареный, без соли",20 кКал,"1,8 г","2,08 г","0,24 г"
"Водный шпинат (болотная капуста) вареный, с солью",20 кКал,"1,8 г","2,08 г","0,24 г"
Водяной кресс (жеруха),11 кКал,"0,79 г","2,3 г","0,1 г"
"Восковая тыква, вареная, без соли",14 кКал,"2,04 г","0,4 г","0,2 г"
"Восковая тыква, вареная, с солью",11 кКал,"1,45 г","0,4 г","0,2 г"
"Восковая тыква, сырая",13 кКал,"0,1 г","0,4 г","0,2 г"
Голубцы овощные по 1-256,95 кКал,"9,7 г","2,2 г","5,2 г"
"Горох и лук, замороженные, вареные, без соли",45 кКал,"6,43 г","2,54 г","0,2 г"
"Горох и лук, замороженные, вареные, с солью",45 кКал,"6,43 г","2,54 г","0,2 г"
"Горох и лук, замороженные, неприготовленные",70 кКал,"10,01 г","3,98 г","0,32 г"
"Горох и лук, консервированные",51 кКал,"6,27 г","3,28 г","0,38 г"
"Горох и морковь, замороженные, вареные, без соли",48 кКал,"7,02 г","3,09 г","0,42 г"
"Горох и морковь, замороженные, вареные, с солью",48 кКал,"7,02 г","3,09 г","0,42 г"
"Горох и морковь, замороженные, неприготовленные",53 кКал,"7,75 г","3,4 г","0,47 г"
"Горох и морковь, консервированные, без добавления соли",38 кКал,"5,18 г","2,17 г","0,27 г"
"Горох и морковь, консервированные, стандартная упаковка",38 кКал,"6,48 г","2,17 г","0,27 г"
"Горчица листовая, вареная, без соли",26 кКал,"2,51 г","2,56 г","0,47 г"
"Горчица листовая, вареная, с солью",26 кКал,"2,51 г","2,56 г","0,47 г"
"Горчица листовая, замороженная, вареная, без соли",19 кКал,"0,31 г","2,27 г","0,25 г"
"Горчица листовая, замороженная, вареная, с солью",19 кКал,"0,31 г","2,27 г","0,25 г"
"Горчица листовая, замороженная, неприготовленная",20 кКал,"0,11 г","2,49 г","0,27 г"
"Горчица листовая, сырая",27 кКал,"1,47 г","2,86 г","0,42 г"
"Горчица шпинатная, вареная, без соли",16 кКал,"0,8 г","1,7 г","0,2 г"
"Горчица шпинатная, вареная, с солью",16 кКал,"0,8 г","1,7 г","0,2 г"
"Горчица шпинатная, сырая",22 кКал,"1,1 г","2,2 г","0,3 г"
Гратен из картофеля,134 кКал,"9,46 г","5,06 г","7,59 г"
"Гратен из картофеля, домашнего приготовления по рецепту с добавлением маргарина",132 кКал,"9,47 г","5,06 г","7,59 г"
"Гратен из картофеля, сухая смесь, неприготовленный",314 кКал,"70,21 г","8,9 г","3,7 г"
"Гратен из картофеля, сухая смесь, приготовленный с добавлением воды, молока и масла",93 кКал,"11,94 г","2,3 г","4,12 г"
"Грифола курчавая, гриб-баран, мейтаке",31 кКал,"4,27 г","1,94 г","0,19 г"
"Джут длинноплодный, вареный, без соли",37 кКал,"5,29 г","3,68 г","0,2 г"
"Джут длинноплодный, вареный, с солью",37 кКал,"5,29 г","3,68 г","0,2 г"
"Джут длинноплодный, сырой",34 кКал,"5,8 г","4,65 г","0,25 г"
Драники картофельные по 1-242,127 кКал,"18,6 г","2,7 г","4,5 г"
"Желуди, тушеные, апачи",95 кКал,"8,52 г","6,81 г","3,47 г"
"Закуска чау-чау, маринованные огурцы и овощи с горчицей, сладкая",121 кКал,"25,14 г","1,5 г","0,9 г"
Запеканка из тыквы по 1-254,137 кКал,"16,3 г","4,1 г","6,1 г"
Запеканка капустная по 1-248,114 кКал,"13,5 г","3,1 г","5,2 г"
Запеканка картофельная с овощами по 1-248,136 кКал,"17,5 г",3 г,"5,9 г"
"Зелень кориандра (кинза), сырая",23 кКал,"0,87 г","2,13 г","0,52 г"
Икра баклажановая. Консервы,148 кКал,"5,1 г","1,7 г","13,3 г"
Икра кабачковая по 1-92,78 кКал,"7,7 г","1,2 г","4,7 г"
Икра кабачковая. Консервы,119 кКал,"7,7 г","1,9 г","8,9 г"
Икра свекольная по 1-96,119 кКал,"11,7 г","2,3 г","6,8 г"
"Имбиря корень маринованный, консервированный, с искуственным подсластителем",20 кКал,"2,23 г","0,33 г","0,1 г"
Имбиря корень сырой,80 кКал,"15,77 г","1,82 г","0,75 г"
Кабачки жареные по 1-238,88 кКал,"7,5 г","1,1 г","5,9 г"
Кабачки запеченные по 1-258,140 кКал,"9,7 г","2,7 г",10 г
Кабачки припущенные по 1-216,39 кКал,5 г,"0,7 г","1,8 г"
Кабачки тушенные в сметане по 2-52,69 кКал,"5,9 г",1 г,"4,7 г"
Кабачки фаршированные овощами по 1-94,130 кКал,"6,3 г","2,3 г","10,5 г"
Кабачок,24 кКал,"4,6 г","0,6 г","0,3 г"
Кабачок желтый,19 кКал,"2,88 г","1,01 г","0,27 г"
"Кабачок желтый вареный, без соли",19 кКал,"2,69 г","1,04 г","0,39 г"
"Кабачок желтый вареный, с солью",19 кКал,"2,69 г","1,04 г","0,39 г"
"Кабачок желтый консервированный, без соли",13 кКал,"1,56 г","0,61 г","0,07 г"
"Кабачок желтый, замороженный",20 кКал,"3,6 г","0,83 г","0,14 г"
"Кабачок желтый, замороженный, вареный, без соли",25 кКал,"4,14 г","1,28 г","0,2 г"
"Кабачок желтый, замороженный, вареный, с солью",25 кКал,"4,14 г","1,28 г","0,2 г"
"Кабачок, все сорта",16 кКал,"2,25 г","1,21 г","0,18 г"
"Кабачок, все сорта, вареный, без соли",20 кКал,"2,91 г","0,91 г","0,31 г"
"Кабачок, все сорта, вареный, с солью",20 кКал,"2,91 г","0,91 г","0,31 г"
"Кале (кудрявая капуста, браунколь)",35 кКал,"0,32 г","2,92 г","1,49 г"
"Кале (кудрявая капуста, браунколь), вареная, без соли",36 кКал,"1,3 г","2,94 г","1,21 г"
"Кале (кудрявая капуста, браунколь), вареная, замороженная, без соли",36 кКал,3 г,"2,94 г","1,21 г"
"Кале (кудрявая капуста, браунколь), замороженная, неприготовленная",28 кКал,"2,88 г","2,66 г","0,46 г"
"Кале, вареная, с солью",44 кКал,3 г,"2,94 г","1,21 г"
"Кале, замороженная, вареная с солью",36 кКал,3 г,"2,94 г","1,21 г"
"Каперсы, консервированные",23 кКал,"1,69 г","2,36 г","0,86 г"
Капуста белокочанная,25 кКал,"3,3 г","1,28 г","0,1 г"
Капуста белокочанная,28 кКал,"4,7 г","1,8 г","0,2 г"
"Капуста белокочанная (датская, домашняя и сорта конической формы), прошлогодняя",24 кКал,"3,07 г","1,21 г","0,18 г"
"Капуста белокочанная (датская, домашняя и сорта конической формы), урожая текущего года, сырая",24 кКал,"3,07 г","1,21 г","0,18 г"
"Капуста белокочанная, вареная, без соли",23 кКал,"3,61 г","1,27 г","0,06 г"
"Капуста белокочанная, вареная, с солью",23 кКал,"3,61 г","1,27 г","0,06 г"
"Капуста белокочанная, квашеная",23 кКал,3 г,"1,8 г","0,1 г"
Капуста жареная по 2-50,50 кКал,"4,2 г","1,8 г","2,8 г"
Капуста запеченная по 1-256,113 кКал,"7,3 г","2,8 г",8 г
"Капуста квашеная, консервированная",19 кКал,"1,38 г","0,91 г","0,14 г"
Капуста краснокочанная,26 кКал,"5,1 г","0,8 г","0,2 г"
"Капуста краснокочанная, вареная, без соли",29 кКал,"4,34 г","1,51 г","0,09 г"
"Капуста краснокочанная, вареная, с солью",29 кКал,"4,34 г","1,51 г","0,09 г"
"Капуста краснокочанная, сырая",31 кКал,"5,27 г","1,43 г","0,16 г"
Капуста маринованная по-японски,30 кКал,"2,57 г","1,6 г","0,1 г"
Капуста отварная по 1-210,24 кКал,"4,2 г","1,4 г","0,1 г"
"Капуста пекинская, приготовленная",12 кКал,"2,23 г","1,1 г","0,17 г"
Капуста припущенная по 1-218,37 кКал,4 г,"1,7 г","1,5 г"
Капуста тушеная по 1-220,75 кКал,"9,2 г",2 г,"3,3 г"
Капустные котлеты по 1-236,153 кКал,"15,3 г","4,2 г","8,2 г"
Картофель,77 кКал,"16,3 г",2 г,"0,4 г"
"Картофель белый неочищенный, печеный",92 кКал,"18,98 г","2,1 г","0,15 г"
"Картофель белый неочищенный, сырой",69 кКал,"13,31 г","1,68 г","0,1 г"
"Картофель дольками, замороженный",129 кКал,"23,46 г","2,7 г","2,2 г"
Картофель жареный брусочками по 1-230,192 кКал,"23,5 г","2,8 г","9,6 г"
Картофель жареный во фритюре по 1-230 (картофель фри),276 кКал,"30,1 г","3,8 г","15,5 г"
Картофель жареный ломтиками (из отварного) по 1-230,161 кКал,"18,6 г","2,3 г","8,6 г"
"Картофель красный неочищенный, печеный",87 кКал,"17,79 г","2,3 г","0,15 г"
"Картофель красный неочищенный, сырой",70 кКал,"14,2 г","1,89 г","0,14 г"
"Картофель красный, запечённый с кожурой",87 кКал,"17,79 г","2,3 г","0,15 г"
"Картофель неочищенный, сырой",77 кКал,"15,39 г","2,05 г","0,09 г"
Картофель О'Брайен (с болгарским перцем) домашнего приготовления,81 кКал,"15,47 г","2,35 г","1,28 г"
"Картофель О'Брайен, замороженный, неприготовленный",76 кКал,"15,57 г","1,83 г","0,14 г"
"Картофель О'Брайен, замороженный, приготовленный",204 кКал,"20,16 г","2,22 г","13,21 г"
"Картофель отваренный в кожуре (в мундире), без соли",87 кКал,"18,33 г","1,87 г","0,1 г"
"Картофель отваренный в кожуре (в мундире), кожура с солью",78 кКал,"13,9 г","2,86 г","0,1 г"
"Картофель отваренный в кожуре (в мундире), кожура, без добавления соли",78 кКал,"13,91 г","2,86 г","0,1 г"
"Картофель отваренный в кожуре (в мундире), с солью",87 кКал,"18,13 г","1,87 г","0,1 г"
Картофель отварной без соли,86 кКал,"18,21 г","1,71 г","0,1 г"
Картофель отварной по 1-206,75 кКал,"15,8 г",2 г,"0,4 г"
Картофель отварной с солью,86 кКал,"18,01 г","1,71 г","0,1 г"
"Картофель печеный, кожура, без соли",198 кКал,"38,16 г","4,29 г","0,1 г"
"Картофель печеный, с солью",93 кКал,"20,05 г","1,96 г","0,1 г"
"Картофель печеный, сердцевина и кожура, с солью",93 кКал,"18,95 г","2,5 г","0,13 г"
"Картофель печеный, сердцевина с кожурой, без соли",93 кКал,"18,95 г","2,5 г","0,13 г"
"Картофель печеный, сердцевина, без соли",93 кКал,"20,05 г","1,96 г","0,1 г"
"Картофель по-селянски, замороженный, неприготовленный",153 кКал,"20,98 г","2,42 г","5,78 г"
"Картофель по-селянски, замороженный, приготовленный без соли, после приготовления в духовке",218 кКал,"30,83 г","3,44 г","8,2 г"
"Картофель по-селянски, замороженный, приготовленный с солью, после приготовление в духовке",218 кКал,"30,83 г","3,44 г","8,2 г"
Картофель сорта Рассет,79 кКал,"16,77 г","2,14 г","0,08 г"
"Картофель сорта Рассет, печеный, сердцевина с кожурой",95 кКал,"19,14 г","2,63 г","0,13 г"
Картофель сушеный,317 кКал,"71,6 г","6,6 г","0,3 г"
Картофель-пюре домашнего приготовления с добавлением молока и маргарина,113 кКал,"15,44 г","1,96 г","4,2 г"
"Картофель-пюре сушеный (дегидрированный), в гранулах не содерщих молока, в сухой форме",372 кКал,"78,41 г","8,22 г","0,54 г"
"Картофель-пюре сушеный (дегидрированный), в гранулах содерщих молоко, в сухой форме",357 кКал,"71,1 г","10,9 г","1,1 г"
"Картофель-пюре сушеный (дегидрированный), приготовленный из гранул не содержащих молока,  с добавлением молока и масла по завершению приготовления",108 кКал,"12,16 г","2,05 г","4,96 г"
"Картофель-пюре сушеный (дегидрированный), приготовленный из гранул содержащих молоко, с добавлением воды и маргарина по завершению приготовления",116 кКал,"14,83 г","2,13 г","4,8 г"
"Картофель-пюре сушеный (дегидрированный), приготовленный из хлопьев не содержащих молока, с добавлением молока и масла по завершению приготовления",97 кКал,"10,07 г","1,77 г","5,13 г"
"Картофель-пюре, приготовленный из гранул не содержащих молоко, в конце приготовления  добавлены молоко и маргарин",108 кКал,"12,2 г","2,05 г","4,93 г"
"Картофель-пюре, приготовленный из хлопьев не содержащих молоко, в конце приготовления  добавлены молоко и маргарин",113 кКал,"12,72 г","1,9 г","5,6 г"
"Картофель-фри всех типов, без добавления соли в процессе жарки, замороженный, до готовки (в сыром виде)",147 кКал,"22,91 г","2,24 г","4,66 г"
