Продукт,Калорийность,Углеводы,Белки,Жиры"Картофель-фри всех типов, без добавления соли в процессе жарки, замороженный, после приготовление в духовке",168 кКал,"26,11 г","2,66 г","5,22 г"
"Картофель-фри всех типов, с добавлением соли, замороженный, домашнего приготовления, после приготовления в духовке",158 кКал,"23,55 г","2,75 г","5,48 г"
"Картофель-фри всех типов, с добавлением соли, замороженный, неприготовленный",147 кКал,"22,91 г","2,24 г","4,66 г"
"Картофель-фри со стейком, с добавлением соли в процессе жарки, замороженный, до готовки (в сыром виде)",130 кКал,"21,61 г","2,19 г","3,39 г"
"Картофель-фри со стейком, с добавлением соли в процессе жарки, замороженный, после приготовления в духовке",148 кКал,"24,38 г","2,57 г","3,76 г"
"Картофель-фри, прессованный, замороженный, неприготовленный",260 кКал,"27,25 г","2,83 г","14,95 г"
"Картофель-фри, прессованный, замороженный, приготовленный без соли, после приготовления в духовке",333 кКал,"36,48 г","3,55 г","18,71 г"
"Картофель-фри, с добавлением соли в процессе жарки, замороженный, до готовки (в сыром виде)",163 кКал,"23,29 г","2,16 г","6,24 г"
"Картофель-фри, с добавлением соли в процессе жарки, замороженный, после приготовления в духовке",194 кКал,"28,86 г","2,9 г","6,76 г"
"Картофель-фри, фигурной или прямой порезки, с добавлением соли в процессе жарки, замороженный, до готовки (в сыром виде)",146 кКал,"21,96 г","2,34 г","4,99 г"
"Картофель-фри, фигурной или прямой порезки, с добавлением соли в процессе жарки, замороженный, после приготовления в духовке",161 кКал,"25,2 г","2,51 г","5,13 г"
"Картофель, замороженный целиком, вареный, без соли",65 кКал,"13,12 г","1,98 г","0,13 г"
"Картофель, замороженный целиком, вареный, без соли",63 кКал,"12,53 г","1,98 г","0,13 г"
"Картофель, запеченный в сметанном соусе по 1-244",114 кКал,"13,8 г","2,5 г","5,3 г"
"Картофель, запеченный с яйцом по 1-244",228 кКал,"19,5 г","4,7 г","14,5 г"
"Картофель, консервированный",44 кКал,"8,49 г","1,2 г","0,11 г"
"Картофель, консервированный, без добавления соли, сухой продукт без маринада",60 кКал,"11,2 г","1,4 г","0,2 г"
"Картофель, консервированный, сухой продукт без маринада",60 кКал,"11,31 г","1,41 г","0,21 г"
"Картофель, приготовленный в микроволновой печи  в кожуре, с солью, целиком",105 кКал,"21,94 г","2,44 г","0,1 г"
"Картофель, приготовленный в микроволновой печи в кожуре, без соли, целиком",105 кКал,"21,94 г","2,44 г","0,1 г"
"Картофель, приготовленный в микроволновой печи в кожуре, сердцевина, без соли",100 кКал,"21,68 г","2,1 г","0,1 г"
"Картофель, приготовленный в микроволновой печи в кожуре, сердцевина, с солью",100 кКал,"21,68 г","2,1 г","0,1 г"
"Картофель, приготовленный в микроволновой печи, только кожура, без  соли",132 кКал,"24,13 г","4,39 г","0,1 г"
"Картофель, приготовленный в микроволновой печи, только кожура, с солью",132 кКал,"24,13 г","4,39 г","0,1 г"
"Картофель, тушенный с грибами по 1-226",134 кКал,"13,4 г","2,5 г","7,7 г"
"Картофельная кожура, запеченая с солью",198 кКал,"38,16 г","4,29 г","0,1 г"
"Картофельная кожура, сырая",58 кКал,"9,94 г","2,57 г","0,1 г"
Картофельное пюре по 1-208,75 кКал,"14,7 г","2,1 г","0,8 г"
Картофельное пюре с молоком,83 кКал,"16,07 г","1,91 г","0,57 г"
Картофельное пюре с молоком и маслом,113 кКал,"15,31 г","1,86 г","4,22 г"
"Картофельное пюре сухое, растворимое, быстрого приготовления (хлопья, крупка)",350 кКал,"79,1 г","5,6 г","0,2 г"
"Картофельное пюре сухое, хлопья без молока",354 кКал,"74,57 г","8,34 г","0,41 г"
Картофельные зразы по 1-232,152 кКал,"20,3 г","2,8 г","6,4 г"
Картофельные котлеты по 1-232,142 кКал,22 г,"2,8 г","4,7 г"
Картофельные котлеты с творогом по 1-232,179 кКал,"15,8 г","8,1 г","9,7 г"
"Картофельные котлеты, запеченные по 1-248",139 кКал,"16,2 г","2,8 г","6,9 г"
Картофельные оладьи,268 кКал,"24,51 г","6,08 г","14,76 г"
"Картофельные шарики, замороженные, неприготовленные",178 кКал,"22,5 г","1,93 г","8,71 г"
"Картофельные шарики, замороженные, приготовленые в духовке",192 кКал,"25,29 г","2,13 г","9,05 г"
Картофельный салат домашнего приготовления,143 кКал,"9,87 г","2,68 г","8,2 г"
Каша из тыквы по 1-218,87 кКал,"15,7 г","2,1 г","1,7 г"
"Кимчи (кимчхи, кимча), квашеная острая пекинская капуста",15 кКал,"0,8 г","1,1 г","0,5 г"
"Кипрей, сырой",150 кКал,"31,68 г","4,6 г","1,8 г"
"Китайская брокколи (кай-лан, гайлан)",26 кКал,"2,07 г","1,2 г","0,76 г"
"Китайская горькая тыква, листья",30 кКал,"3,29 г","5,3 г","0,69 г"
"Китайская горькая тыква, листья, вареные с солью",32 кКал,"4,26 г","3,6 г","0,2 г"
"Китайская горькая тыква, листья, вареные, без соли",34 кКал,"4,78 г","3,6 г","0,2 г"
"Китайская горькая тыква, плоды",17 кКал,"0,9 г",1 г,"0,17 г"
"Китайская горькая тыква, плоды вареные без соли",19 кКал,"2,32 г","0,84 г","0,18 г"
"Китайская горькая тыква, плоды вареные с солью",19 кКал,"2,32 г","0,84 г","0,18 г"
"Козлобородник (овсяный корень, овощная устрица), вареный, без соли",68 кКал,"12,26 г","2,73 г","0,17 г"
"Козлобородник (овсяный корень, овощная устрица), вареный, с солью",68 кКал,"12,26 г","2,73 г","0,17 г"
"Козлобородник (овсяный корень, овощная устрица), сырой",82 кКал,"15,3 г","3,3 г","0,2 г"
"Колоказия (таро) таитянская, приготовленная без соли",44 кКал,"6,85 г","4,16 г","0,68 г"
"Колоказия (таро) таитянская, приготовленная с солью",44 кКал,"6,85 г","4,16 г","0,68 г"
"Колоказия (таро) таитянская, сырая",44 кКал,"6,91 г","2,79 г","0,97 г"
"Колоказия (таро), листья, приготовленные на пару, без соли",24 кКал,"2,02 г","2,72 г","0,41 г"
"Колоказия (таро), листья, приготовленные на пару, с солью",24 кКал,"1,89 г","2,72 г","0,41 г"
"Колоказия (таро), листья, сырые",42 кКал,3 г,"4,98 г","0,74 г"
"Колоказия (таро), побеги, приготовленные без соли",14 кКал,"3,2 г","0,73 г","0,08 г"
"Колоказия (таро), побеги, приготовленные с солью",14 кКал,"3,19 г","0,73 г","0,08 г"
"Колоказия (таро), побеги, сырые",11 кКал,"2,32 г","0,92 г","0,09 г"
"Колоказия (таро), приготовленная без соли",142 кКал,"29,5 г","0,52 г","0,11 г"
"Колоказия (таро), приготовленная с солью",142 кКал,"29,5 г","0,52 г","0,11 г"
"Колоказия (таро), сырая",112 кКал,"22,36 г","1,5 г","0,2 г"
Кольраби,44 кКал,"7,9 г","2,8 г","0,1 г"
Кольраби,27 кКал,"2,6 г","1,7 г","0,1 г"
"Кольраби, вареная, без соли",29 кКал,"5,59 г","1,8 г","0,11 г"
"Кольраби, вареная, с солью",29 кКал,"5,59 г","1,8 г","0,11 г"
"Корень лопуха, вареный, без соли",88 кКал,"19,35 г","2,09 г","0,14 г"
"Корень лопуха, вареный, с солью",88 кКал,"19,35 г","2,09 г","0,14 г"
"Корень лопуха, сырой",72 кКал,"14,04 г","1,53 г","0,15 г"
"Корень лотоса, вареный, без соли",66 кКал,"12,92 г","1,58 г","0,07 г"
"Корень лотоса, вареный, с солью",66 кКал,"12,92 г","1,58 г","0,07 г"
"Корень лотоса, сырой",74 кКал,"12,33 г","2,6 г","0,1 г"
"Корень цикория, сырой",72 кКал,"16,01 г","1,4 г","0,2 г"
Кресс-салат,32 кКал,"4,4 г","2,6 г","0,7 г"
"Кресс-салат, вареный, без соли",23 кКал,"3,1 г","1,9 г","0,6 г"
"Кресс-салат, вареный, с солью",23 кКал,"3,1 г","1,9 г","0,6 г"
"Кукуруза сахарная белая, вареная, без соли",97 кКал,"19,01 г","3,34 г","1,41 г"
"Кукуруза сахарная белая, вареная, с солью",97 кКал,"19,01 г","3,34 г","1,41 г"
"Кукуруза сахарная белая, замороженная, в початках",98 кКал,"20,7 г","3,28 г","0,78 г"
"Кукуруза сахарная белая, замороженная, в початках, вареная, без соли",94 кКал,"20,23 г","3,11 г","0,74 г"
"Кукуруза сахарная белая, замороженная, в початках, вареная, с солью",94 кКал,"19,53 г","3,11 г","0,74 г"
"Кукуруза сахарная белая, замороженная, свежие срезанные зерна",88 кКал,"17,83 г","3,02 г","0,77 г"
"Кукуруза сахарная белая, замороженная, свежие срезанные зерна, вареная, без соли",80 кКал,"17,16 г","2,75 г","0,43 г"
"Кукуруза сахарная белая, замороженная, свежие срезанные зерна, вареная, с солью",80 кКал,"17,16 г","2,75 г","0,43 г"
"Кукуруза сахарная белая, консервированная в вакуумной упаковке, без соли",79 кКал,"17,44 г","2,41 г","0,5 г"
"Кукуруза сахарная белая, консервированная цельными зернами",64 кКал,"13,71 г","1,95 г","0,5 г"
"Кукуруза сахарная белая, консервированная цельными зернами, без соли",64 кКал,"14,71 г","1,95 г","0,5 г"
"Кукуруза сахарная белая, консервированная цельными зернами, содержимое без жидкости",67 кКал,"12,34 г","2,29 г","1,22 г"
"Кукуруза сахарная белая, консервированная, в вакуумной упаковке",79 кКал,"17,44 г","2,41 г","0,5 г"
"Кукуруза сахарная белая, консервированная, раздавленные зерна",74 кКал,"17,42 г","1,74 г","0,42 г"
"Кукуруза сахарная белая, консервированная, раздавленные зерна, без соли",72 кКал,"16,93 г","1,74 г","0,42 г"
"Кукуруза сахарная белая, свежая",86 кКал,"16,32 г","3,22 г","1,18 г"
"Кукуруза сахарная желтая, в початках, замороженная, вареная, без соли",94 кКал,"19,53 г","3,11 г","0,74 г"
"Кукуруза сахарная желтая, в початках, замороженная, вареная, с солью",94 кКал,"19,53 г","3,11 г","0,74 г"
"Кукуруза сахарная желтая, в початках, замороженная, неприготовленная",98 кКал,"20,7 г","3,28 г","0,78 г"
"Кукуруза сахарная желтая, вареная, без соли",96 кКал,"18,58 г","3,41 г","1,5 г"
"Кукуруза сахарная желтая, вареная, с солью",96 кКал,"18,58 г","3,41 г","1,5 г"
"Кукуруза сахарная желтая, замороженная, свежие срезанные зерна, вареная, с солью",79 кКал,"16,31 г","2,55 г","0,67 г"
"Кукуруза сахарная желтая, замороженная, свежие срезанные зерна, вареные, без соли",81 кКал,"16,9 г","2,55 г","0,67 г"
"Кукуруза сахарная желтая, замороженная, свежие срезанные зерна, неприготовленные",88 кКал,"18,61 г","3,02 г","0,78 г"
"Кукуруза сахарная желтая, консервированная в вакуумной упаковке",79 кКал,"17,44 г","2,41 г","0,5 г"
"Кукуруза сахарная желтая, консервированная в вакуумной упаковке, без соли",79 кКал,"17,44 г","2,41 г","0,5 г"
"Кукуруза сахарная желтая, консервированная цельными зернами, содержимое без жидкости",67 кКал,"12,34 г","2,29 г","1,22 г"
"Кукуруза сахарная желтая, консервированная, без соли",61 кКал,"12,16 г","1,95 г","0,77 г"
"Кукуруза сахарная желтая, консервированная, раздавленные зерна",72 кКал,"16,93 г","1,74 г","0,42 г"
"Кукуруза сахарная желтая, консервированная, раздавленные зерна, без соли",72 кКал,"16,93 г","1,74 г","0,42 г"
"Кукуруза сахарная желтая, консервированная, содержимое с жидкостью",61 кКал,"12,16 г","1,95 г","0,77 г"
"Кукуруза сахарная желтая, свежая",86 кКал,"16,7 г","3,27 г","1,35 г"
"Лаконос, вареный, без соли",20 кКал,"1,6 г","2,3 г","0,4 г"
"Лаконос, вареный, с солью",20 кКал,"1,6 г","2,3 г","0,4 г"
"Лаконос, сырой",23 кКал,2 г,"2,6 г","0,4 г"
Лебеда (марь белая),43 кКал,"3,3 г","4,2 г","0,8 г"
"Лебеда (марь белая), вареная, без соли",32 кКал,"2,9 г","3,2 г","0,7 г"
"Лебеда (марь белая), вареная, с солью",32 кКал,"2,9 г","3,2 г","0,7 г"
"Лебеда (марь), приготовленная на пару (индейцы северных великих равнин)",48 кКал,"2,27 г","4,06 г","0,16 г"
Листовая капуста (коллард),32 кКал,"1,42 г","3,02 г","0,61 г"
"Листовая капуста (коллард), вареная, без соли",33 кКал,"1,65 г","2,71 г","0,72 г"
"Листовая капуста (коллард), вареный, с солью",33 кКал,"1,65 г","2,71 г","0,72 г"
"Листовая капуста (коллард), замороженная, вареная, без соли",36 кКал,"4,3 г","2,97 г","0,41 г"
"Листовая капуста (коллард), замороженная, неприготовленная",33 кКал,"2,86 г","2,69 г","0,37 г"
"Листовая капуста (коллард), замороженный, вареный, с солью",36 кКал,"4,3 г","2,97 г","0,41 г"
Листья одуванчика,45 кКал,"5,7 г","2,7 г","0,7 г"
"Листья одуванчика, вареные, без соли",33 кКал,"3,5 г",2 г,"0,6 г"
"Листья одуванчика, вареные, с солью",33 кКал,"3,5 г",2 г,"0,6 г"
"Листья цикория, сырые",23 кКал,"0,7 г","1,7 г","0,3 г"
Лук батун,34 кКал,"4,1 г","1,9 г","0,4 г"
Лук жареный по 2-56,251 кКал,"27,4 г","4,5 г","13,5 г"
"Лук желтый, пассерованный",123 кКал,"6,16 г","0,95 г","10,8 г"
Лук зеленый (перо),20 кКал,"3,2 г","1,3 г","0,1 г"
Лук зелёный из семян (включая зелень и молодые луковицы),32 кКал,"4,74 г","1,83 г","0,19 г"
"Лук зелёный, зелень (перо) репчатого лука",27 кКал,"3,94 г","0,97 г","0,47 г"
Лук маринованный по 2-56,79 кКал,"7,6 г","1,2 г","4,7 г"
Лук порей,36 кКал,"6,3 г",2 г,"0,2 г"
Лук порей (луковица и нижняя часть зелени),61 кКал,"12,35 г","1,5 г","0,3 г"
"Лук порей (луковица и нижняя часть зелени), вареный, без соли",31 кКал,"6,62 г","0,81 г","0,2 г"
"Лук порей (луковицы и нижняя часть зелени), вареный, с солью",31 кКал,"6,62 г","0,81 г","0,2 г"
"Лук порей (луковицы и нижняя часть зелени), сублимированный (сушеный)",321 кКал,"64,25 г","15,2 г","2,1 г"
Лук репчатый,41 кКал,"8,2 г","1,4 г","0,2 г"
"Лук репчатый, вареный, без соли",44 кКал,"8,75 г","1,36 г","0,19 г"
"Лук репчатый, вареный, с солью",42 кКал,"8,16 г","1,36 г","0,19 г"
"Лук репчатый, замороженный целиком, вареный, без соли",28 кКал,"5,3 г","0,71 г","0,05 г"
"Лук репчатый, замороженный целиком, вареный, с солью",26 кКал,"4,71 г","0,71 г","0,05 г"
"Лук репчатый, замороженный целиком, неприготовленный",35 кКал,"6,75 г","0,89 г","0,06 г"
"Лук репчатый, замороженный, порезанный, вареный, с солью",26 кКал,"4,3 г","0,77 г","0,1 г"
"Лук репчатый, консервированный",19 кКал,"2,82 г","0,85 г","0,09 г"
"Лук репчатый, порезанный, замороженный, вареный, без соли",28 кКал,"4,79 г","0,77 г","0,1 г"
"Лук репчатый, порезанный, замороженный, неприготовленный",29 кКал,"5,02 г","0,79 г","0,1 г"
"Лук репчатый, сушеный",208 кКал,"42,6 г","8,4 г","2,8 г"
"Лук репчатый, сушеный (дегидрированный), хлопья",349 кКал,"74,08 г","8,95 г","0,46 г"
"Лук репчатый, сырой",40 кКал,"7,64 г","1,1 г","0,1 г"
"Лук сладкий, сырой",32 кКал,"6,65 г","0,8 г","0,08 г"
"Лук-резанец (скорода, шнитт-лук)",30 кКал,"1,85 г","3,27 г","0,73 г"
"Лук-резанец (скорода, шнитт-лук), сублимированный (сушеный)",311 кКал,"38,09 г","21,2 г","3,5 г"
"Лук-шалот, сырой",72 кКал,"13,6 г","2,5 г","0,1 г"
"Луковые кольца, обжаренные в панировке, замороженные, приготовленные в духовке",276 кКал,"31,59 г","4,14 г","14,3 г"
"Луковые кольца, обжаренный в панировке, замороженный, неприготовленный",258 кКал,"28,73 г","3,15 г","14,1 г"
Люффа  (мочалочная тыква),20 кКал,"3,25 г","1,2 г","0,2 г"
"Люффа  (мочалочная тыква), вареная, без соли",56 кКал,"11,44 г","0,66 г","0,34 г"
"Люффа  (мочалочная тыква), вареная, с солью",54 кКал,"10,85 г","0,66 г","0,34 г"
"Малабарский шпинат (базелла), сырой",19 кКал,"3,4 г","1,8 г","0,3 г"
"Маланга (ксантосома), сырая",98 кКал,"22,13 г","1,46 г","0,4 г"
Мангольд,19 кКал,"2,14 г","1,8 г","0,2 г"
"Мангольд, вареный, без соли",20 кКал,"2,03 г","1,88 г","0,08 г"
"Мангольд, вареный, с солью",20 кКал,"2,03 г","1,88 г","0,08 г"
"Маниок, сырой",160 кКал,"36,26 г","1,36 г","0,28 г"
"Маранта, сырая",65 кКал,"12,09 г","4,24 г","0,2 г"
"Маслины черные (оливки созревшие) крупные, консервированные",81 кКал,"3,11 г","0,97 г","6,87 г"
"Маслины черные (оливки созревшие) мелкие и средние, консервированные",116 кКал,"4,44 г","0,84 г","10,9 г"
"Моринга масличная, листья, вареные, без соли",60 кКал,"9,15 г","5,27 г","0,93 г"
"Моринга масличная, листья, вареные, с солью",60 кКал,"9,15 г","5,27 г","0,93 г"
"Моринга масличная, листья, сырые",64 кКал,"6,28 г","9,4 г","1,4 г"
"Моринга масличная, стручки, вареные, без соли",36 кКал,"3,98 г","2,09 г","0,19 г"
"Моринга масличная, стручки, вареные, с солью",36 кКал,"3,98 г","2,09 г","0,19 г"
"Моринга масличная, стручки, сырые",37 кКал,"5,33 г","2,1 г","0,2 г"
Морковная запеканка по 1-250,128 кКал,"17,8 г","2,7 г",5 г
Морковное пюре по 1-212,90 кКал,"8,1 г","1,9 г","5,6 г"
Морковные котлеты по 1-234,152 кКал,"19,2 г","3,4 г","6,7 г"
Морковный пуддинг по 1-250,106 кКал,14 г,3 г,"4,1 г"
Морковь,35 кКал,"6,9 г","1,3 г","0,1 г"
Морковь,41 кКал,"6,78 г","0,93 г","0,24 г"
Морковь желтая,30 кКал,"6,2 г","1,3 г","0,1 г"
Морковь квашеная,26 кКал,"4,5 г","1,3 г","0,1 г"
Морковь молодая ,35 кКал,"5,34 г","0,64 г","0,13 г"
Морковь отварная по 2-40,33 кКал,"6,4 г","1,3 г","0,1 г"
Морковь припущенная по 1-214,52 кКал,"7,7 г","1,4 г","1,6 г"
Морковь сушеная,226 кКал,"49,2 г","7,8 г","0,6 г"
Морковь сушеная (дегидрированная),341 кКал,"55,97 г","8,1 г","1,49 г"
Морковь тушеная с рисом по 1-224,122 кКал,"17,2 г","1,8 г",5 г
"Морковь, вареная, без соли",35 кКал,"5,22 г","0,76 г","0,18 г"
"Морковь, вареная, с солью",35 кКал,"5,22 г","0,76 г","0,18 г"
"Морковь, замороженная",36 кКал,"4,6 г","0,78 г","0,46 г"
"Морковь, замороженная, вареная, без соли",37 кКал,"4,43 г","0,58 г","0,68 г"
"Морковь, замороженная, вареная, с солью",37 кКал,"4,43 г","0,58 г","0,68 г"
"Морковь, консервированная",23 кКал,"3,57 г","0,58 г","0,14 г"
"Морковь, консервированная, без добавления соли",23 кКал,"3,56 г","0,59 г","0,14 г"
"Морковь, консервированная, сухой продукт без маринада",25 кКал,"4,04 г","0,64 г","0,19 г"
"Морковь, консервированная, сушеная, без добавления соли, сухой продукт без маринада",25 кКал,"4,04 г","0,64 г","0,19 г"
