Продукт,Калорийность,Углеводы,Белки,Жиры"Фуа-гра, консервированная гусиная печень, копченная",462 кКал,"4,67 г","11,4 г","43,84 г"
Цесарка,158 кКал,0 г,"23,4 г","6,45 г"
"Цесарка, только мясо",110 кКал,0 г,"20,64 г","2,47 г"
"Цыплята жареные, по 2-14",261 кКал,"0,1 г",24 г,"18,3 г"
"Цыплята отварные, по 2-4",211 кКал,0 г,"21,1 г","13,6 г"
"Цыплята табака жареные, по 2-20",281 кКал,"0,1 г","24,8 г","20,2 г"
"Эму, верхняя часть филе, жареное на огне",152 кКал,0 г,"29,07 г","3,13 г"
"Эму, внутрення часть голени",108 кКал,0 г,"22,22 г","1,49 г"
"Эму, внутрення часть голени, жареная на огне",156 кКал,0 г,"32,38 г","2,01 г"
"Эму, мышца-подниматель хвоста, жареное на огне",154 кКал,0 г,"31,27 г","2,3 г"
"Эму, мышца-подниматель хвоста, сырое",103 кКал,0 г,"22,5 г","0,8 г"
"Эму, наружная часть голени",103 кКал,0 г,"23,08 г","0,48 г"
"Эму, нежное мясо спины, сырое",141 кКал,0 г,"22,81 г","4,86 г"
"Эму, огузок",112 кКал,0 г,"22,83 г","1,64 г"
"Эму, огузок, жареный на огне",168 кКал,0 г,"33,67 г","2,68 г"
"Эму, плоское филе, сырое",102 кКал,0 г,"22,25 г","0,74 г"
"Эму, фарш",134 кКал,0 г,"22,77 г","4,03 г"
"Эму, фарш, жареный на сковороде",163 кКал,0 г,"28,43 г","4,65 г"
